{
  "schema": "topik-item-1",
  "batch": "ti-r-b",
  "author": "claude-opus-5-5 · Claude Code 하위 에이전트 · 2026-10-20",
  "items": [
    {
      "id": "ti-r-b-001",
      "rev": 1,
      "family": "ti-r-b-001",
      "exam": "topik-i",
      "format": "pbt",
      "section": "reading",
      "officialType": "TI-R-55",
      "targetGrade": 2,
      "skillId": "ko.reading.grammar",
      "difficulty": 2,
      "responseFormat": "single-choice",
      "set": {
        "id": "ti-r-b-s01",
        "order": 1
      },
      "passage": "겨울이 되면 시청 앞에 스케이트장이 생깁니다. 이 스케이트장은 12월부터 2월까지 매일 문을 엽니다. (   ) 비나 눈이 많이 오는 날에는 문을 닫습니다. 스케이트장에 들어갈 때는 1,000원을 내고, 스케이트를 빌리면 2,000원을 더 내야 합니다. 일곱 살이 안 된 어린이는 어른과 같이 와야 탈 수 있습니다.",
      "script": null,
      "question": "(   )에 들어갈 알맞은 말을 고르십시오.",
      "choices": [
        "그래서",
        "그리고",
        "하지만",
        "그러면"
      ],
      "answer": 2,
      "explanation": {
        "ko": "앞 문장은 「12월부터 2월까지 매일 문을 엽니다」인데 뒤 문장은 「비나 눈이 많이 오는 날에는 문을 닫습니다」예요. 앞의 말과 반대되는 내용이 이어지니까 「하지만」이 맞아요. 「그리고」를 넣으면 매일 연다는 말과 문을 닫는다는 말이 서로 부딪쳐요.",
        "en": "The sentence before the blank says 「12월부터 2월까지 매일 문을 엽니다」 (it is open every day from December to February), but the next one says 「비나 눈이 많이 오는 날에는 문을 닫습니다」 (it closes on days with heavy rain or snow). The second sentence goes against the first, so 「하지만」 (but) is the answer. With 「그리고」 (and), \"open every day\" and \"closes\" would clash.",
        "mn": "Хоосон зайны өмнөх өгүүлбэр 「12월부터 2월까지 매일 문을 엽니다」 (12-р сараас 2-р сар хүртэл өдөр бүр нээлттэй) гэсэн боловч дараагийн өгүүлбэр 「비나 눈이 많이 오는 날에는 문을 닫습니다」 (бороо, цас ихтэй өдөр хаалттай) гэжээ. Хоёр дахь өгүүлбэр эхнийхийнхээ эсрэг тул 「하지만」 (гэвч) зөв. 「그리고」 (бас) гэж холбовол «өдөр бүр нээлттэй», «хаалттай» гэсэн хоёр санаа зөрчилдөнө."
      },
      "choiceNotes": [
        "앞 문장(매일 문을 엶)이 뒤 문장(문을 닫음)의 까닭이 아니어서 틀려요.",
        "「그리고」는 같은 방향의 말을 더하는데, 「매일」 연다는 말과 문을 닫는다는 말이 부딪쳐서 틀려요.",
        "「매일 문을 엽니다」와 반대되는 예외가 이어지므로 맞아요.",
        "앞 문장이 조건이나 할 일이 아니라서 「그러면」으로 이을 수 없어요."
      ],
      "conceptIds": [],
      "audio": null,
      "origin": "synk-original",
      "reviewStatus": "draft",
      "review": []
    },
    {
      "id": "ti-r-b-002",
      "rev": 1,
      "family": "ti-r-b-002",
      "exam": "topik-i",
      "format": "pbt",
      "section": "reading",
      "officialType": "TI-R-56",
      "targetGrade": 2,
      "skillId": "ko.reading.condition",
      "difficulty": 2,
      "responseFormat": "single-choice",
      "set": {
        "id": "ti-r-b-s01",
        "order": 2
      },
      "passage": "겨울이 되면 시청 앞에 스케이트장이 생깁니다. 이 스케이트장은 12월부터 2월까지 매일 문을 엽니다. (   ) 비나 눈이 많이 오는 날에는 문을 닫습니다. 스케이트장에 들어갈 때는 1,000원을 내고, 스케이트를 빌리면 2,000원을 더 내야 합니다. 일곱 살이 안 된 어린이는 어른과 같이 와야 탈 수 있습니다.",
      "script": null,
      "question": "이 글의 내용과 같은 것을 고르십시오.",
      "choices": [
        "스케이트를 빌리면 모두 3,000원을 내야 합니다.",
        "이 스케이트장은 1년 내내 문을 엽니다.",
        "비나 눈이 많이 와도 스케이트를 탈 수 있습니다.",
        "일곱 살이 안 된 어린이도 혼자 와서 탈 수 있습니다."
      ],
      "answer": 0,
      "explanation": {
        "ko": "들어갈 때 「1,000원을 내고」, 「스케이트를 빌리면 2,000원을 더 내야 합니다」라고 했으니까 스케이트를 빌리면 모두 3,000원이에요. 스케이트장은 「12월부터 2월까지」만 문을 여니까 1년 내내 연다는 것은 틀려요.",
        "en": "You pay 「1,000원」 (1,000 won) to go in, and 「스케이트를 빌리면 2,000원을 더 내야 합니다」 (if you rent skates, you pay 2,000 won more). So renting skates costs 3,000 won in total. The rink is open only 「12월부터 2월까지」 (from December to February), so the choice saying it is open all year is wrong.",
        "mn": "Орохдоо 「1,000원」 (1,000 вон) төлж, 「스케이트를 빌리면 2,000원을 더 내야 합니다」 (тэшүүр түрээслэвэл 2,000 вон нэмж төлнө) гэжээ. Тиймээс тэшүүр түрээслэвэл нийт 3,000 вон болно. Тэшүүрийн талбай зөвхөн 「12월부터 2월까지」 (12-р сараас 2-р сар хүртэл) ажилладаг тул жилийн турш нээлттэй гэсэн нь буруу."
      },
      "choiceNotes": [
        "들어갈 때 1,000원에 「스케이트를 빌리면 2,000원을 더」 내니 모두 3,000원이에요.",
        "스케이트장은 「12월부터 2월까지」 문을 열어요.",
        "비나 눈이 많이 오는 날에는 「문을 닫습니다」.",
        "일곱 살이 안 된 어린이는 「어른과 같이 와야」 탈 수 있어요."
      ],
      "conceptIds": [
        "G401"
      ],
      "audio": null,
      "origin": "synk-original",
      "reviewStatus": "draft",
      "review": []
    },
    {
      "id": "ti-r-b-003",
      "rev": 1,
      "family": "ti-r-b-003",
      "exam": "topik-i",
      "format": "pbt",
      "section": "reading",
      "officialType": "TI-R-55",
      "targetGrade": 2,
      "skillId": "ko.reading.grammar",
      "difficulty": 2,
      "responseFormat": "single-choice",
      "set": {
        "id": "ti-r-b-s02",
        "order": 1
      },
      "passage": "우리 동네 시장은 지난달부터 배달을 시작했습니다. 시장 근처에는 나이가 많은 분들이 많이 사시는데, 무거운 물건을 들고 집까지 걸어가기가 힘드셨습니다. (   ) 시장 사람들이 함께 배달을 하기로 했습니다. 배달은 하루에 두 번, 낮 12시와 저녁 6시에 합니다. 배달비는 없지만 3만 원 이상 사야 합니다.",
      "script": null,
      "question": "(   )에 들어갈 알맞은 말을 고르십시오.",
      "choices": [
        "그러면",
        "하지만",
        "그래도",
        "그래서"
      ],
      "answer": 3,
      "explanation": {
        "ko": "앞 문장에서 나이가 많은 분들은 「무거운 물건을 들고 집까지 걸어가기가 힘드셨습니다」라고 했어요. 이것이 까닭이 되어 「시장 사람들이 함께 배달을 하기로 했습니다」라는 결과가 이어지니까 「그래서」가 맞아요. 「그래도」는 앞의 일과 다른 쪽으로 일이 이어질 때 써서 여기에는 맞지 않아요.",
        "en": "The sentence before the blank says older residents found it 「무거운 물건을 들고 집까지 걸어가기가 힘드셨습니다」 (hard to walk home carrying heavy things). That is the cause, and the result follows: 「시장 사람들이 함께 배달을 하기로 했습니다」 (the market people decided to deliver together). So 「그래서」 (so) is right. 「그래도」 (even so) is used when what follows goes against what came before, which is not the case here.",
        "mn": "Өмнөх өгүүлбэрт настай хүмүүст 「무거운 물건을 들고 집까지 걸어가기가 힘드셨습니다」 (хүнд юм бариад гэр хүртлээ алхахад хэцүү байсан) гэжээ. Энэ шалтгааны үр дүнд 「시장 사람들이 함께 배달을 하기로 했습니다」 (зах дээрх хүмүүс хамтдаа хүргэлт хийхээр шийдсэн) гэж үргэлжилж байгаа тул 「그래서」 (тиймээс) зөв. 「그래도」 (тэгсэн ч гэсэн) нь өмнөх зүйлийн эсрэг үр дүнд хэрэглэгддэг тул энд тохирохгүй."
      },
      "choiceNotes": [
        "「그러면」은 조건이나 할 일 뒤에 오는데, 앞 문장은 이미 있었던 일이라 맞지 않아요.",
        "걸어가기 힘든 것과 배달을 하기로 한 것은 반대되는 내용이 아니어서 틀려요.",
        "힘드셔서 배달을 하기로 한 것이지, 힘든데도 한 일이 아니어서 틀려요.",
        "걸어가기가 힘든 것이 까닭이고 배달을 하기로 한 것이 결과라서 맞아요."
      ],
      "conceptIds": [],
      "audio": null,
      "origin": "synk-original",
      "reviewStatus": "draft",
      "review": []
    },
    {
      "id": "ti-r-b-004",
      "rev": 1,
      "family": "ti-r-b-004",
      "exam": "topik-i",
      "format": "pbt",
      "section": "reading",
      "officialType": "TI-R-56",
      "targetGrade": 2,
      "skillId": "ko.reading.detail",
      "difficulty": 2,
      "responseFormat": "single-choice",
      "set": {
        "id": "ti-r-b-s02",
        "order": 2
      },
      "passage": "우리 동네 시장은 지난달부터 배달을 시작했습니다. 시장 근처에는 나이가 많은 분들이 많이 사시는데, 무거운 물건을 들고 집까지 걸어가기가 힘드셨습니다. (   ) 시장 사람들이 함께 배달을 하기로 했습니다. 배달은 하루에 두 번, 낮 12시와 저녁 6시에 합니다. 배달비는 없지만 3만 원 이상 사야 합니다.",
      "script": null,
      "question": "이 글의 내용과 같은 것을 고르십시오.",
      "choices": [
        "이 시장은 다음 달부터 배달을 시작합니다.",
        "배달은 낮과 저녁, 하루에 두 번 합니다.",
        "배달비를 내야 배달을 받을 수 있습니다.",
        "3만 원보다 적게 사도 배달을 해 줍니다."
      ],
      "answer": 1,
      "explanation": {
        "ko": "글에 「배달은 하루에 두 번, 낮 12시와 저녁 6시에 합니다」라고 했으니까 배달은 낮과 저녁에 두 번 해요. 「배달비는 없지만 3만 원 이상 사야 합니다」라고 했으니까 배달비를 낸다는 것과 3만 원보다 적게 사도 된다는 것은 둘 다 틀려요.",
        "en": "The text says 「배달은 하루에 두 번, 낮 12시와 저녁 6시에 합니다」 (deliveries are made twice a day, at 12 noon and 6 p.m.), so they deliver twice, at midday and in the evening. It also says 「배달비는 없지만 3만 원 이상 사야 합니다」 (there is no delivery fee, but you must buy 30,000 won or more), so the choices about paying a fee or buying less than 30,000 won are both wrong.",
        "mn": "Эхэд 「배달은 하루에 두 번, 낮 12시와 저녁 6시에 합니다」 (хүргэлтийг өдөрт хоёр удаа, өдрийн 12 цаг, оройн 6 цагт хийдэг) гэсэн тул өдөр, орой хоёр удаа хүргэдэг. Мөн 「배달비는 없지만 3만 원 이상 사야 합니다」 (хүргэлтийн төлбөргүй ч 30,000 воноос дээш худалдан авах ёстой) гэсэн тул хүргэлтийн төлбөр төлнө, 30,000 воноос бага авсан ч болно гэсэн сонголтууд хоёулаа буруу."
      },
      "choiceNotes": [
        "배달은 「지난달부터」 시작했어요.",
        "「하루에 두 번, 낮 12시와 저녁 6시에」 한다는 내용과 같아요.",
        "「배달비는 없지만」이라고 했으니 배달비를 내지 않아요.",
        "「3만 원 이상 사야」 배달을 받을 수 있어요."
      ],
      "conceptIds": [
        "G212"
      ],
      "audio": null,
      "origin": "synk-original",
      "reviewStatus": "draft",
      "review": []
    },
    {
      "id": "ti-r-b-005",
      "rev": 1,
      "family": "ti-r-b-005",
      "exam": "topik-i",
      "format": "pbt",
      "section": "reading",
      "officialType": "TI-R-55",
      "targetGrade": 2,
      "skillId": "ko.reading.grammar",
      "difficulty": 2,
      "responseFormat": "single-choice",
      "set": {
        "id": "ti-r-b-s03",
        "order": 1
      },
      "passage": "비가 오는 날에는 빨래가 잘 마르지 않습니다. 공기 속에 물이 많기 때문입니다. 이런 날에는 빨래가 끝나면 바로 세탁기에서 꺼내십시오. 그리고 옷과 옷 사이를 넓게 두고 말리십시오. (   ) 바람이 잘 통해서 빨래가 빨리 마릅니다.",
      "script": null,
      "question": "(   )에 들어갈 알맞은 말을 고르십시오.",
      "choices": [
        "그러면",
        "그런데",
        "그래서",
        "하지만"
      ],
      "answer": 0,
      "explanation": {
        "ko": "앞 문장 「옷과 옷 사이를 넓게 두고 말리십시오」는 할 일이고, 뒤 문장은 그렇게 했을 때의 결과예요. ‘이렇게 하면 이렇게 된다’를 이을 때는 「그러면」을 써요. 「그래서」는 이미 있는 사실 뒤에 쓰고 「-(으)십시오」 같은 명령 뒤에는 쓰지 않아요.",
        "en": "The sentence before the blank, 「옷과 옷 사이를 넓게 두고 말리십시오」 (dry the clothes with space between them), is an instruction, and the next sentence tells what happens when you do it. To link \"do this, and this will happen\", use 「그러면」 (then / if you do so). 「그래서」 (so) follows a fact, not an instruction like 「-(으)십시오」.",
        "mn": "Хоосон зайны өмнөх 「옷과 옷 사이를 넓게 두고 말리십시오」 (хувцас хооронд зай гаргаж хатаагаарай) гэдэг нь зөвлөгөө, дараагийн өгүүлбэр нь тэгэхэд юу болохыг хэлж байна. «Ингэвэл ийм болно» гэж холбоход 「그러면」 (тэгвэл) хэрэглэдэг. 「그래서」 (тиймээс) нь болсон баримтын дараа ордог бөгөөд 「-(으)십시오」 шиг тушаалын дараа хэрэглэдэггүй."
      },
      "choiceNotes": [
        "「넓게 두고 말리십시오」라는 방법 뒤에 그 결과를 이어 주므로 맞아요.",